{
  "version": "1.0.0",
  "frozen_at": "2026-04-15T00:00:00Z",
  "frozen_commit": null,
  "source_plan_sha256": "3457dbeeb593816eef0446d0ffaac1bd7bea3e9b5d5db5e251e015eec4f93fcf",
  "features": [
    {
      "id": "P0-W1-F01",
      "phase": 0,
      "week": 1,
      "crate": "ucil-core",
      "description": "Cargo workspace, TypeScript pnpm workspace, and uv Python environment are configured and all build targets compile cleanly.",
      "acceptance_tests": [
        {
          "kind": "cargo_test",
          "selector": "-p ucil-core"
        }
      ],
      "dependencies": [],
      "passes": true,
      "last_verified_ts": "2026-04-14T22:38:11Z",
      "last_verified_by": "verifier-6c4f652d-b7fa-40fd-a006-15511bf9129c",
      "last_verified_commit": "7f5650c7e96631c425199a82fe2f5c38bd312f34",
      "attempts": 0,
      "blocked_reason": null
    },
    {
      "id": "P0-W1-F02",
      "phase": 0,
      "week": 1,
      "crate": "ucil-core",
      "description": "Core type system defined in ucil-core/src/types.rs: QueryPlan, Symbol, Diagnostic, KnowledgeEntry, ToolGroup, CeqpParams, ResponseEnvelope.",
      "acceptance_tests": [
        {
          "kind": "cargo_test",
          "selector": "-p ucil-core types::"
        }
      ],
      "dependencies": [
        "P0-W1-F01"
      ],
      "passes": true,
      "last_verified_ts": "2026-04-14T23:27:33Z",
      "last_verified_by": "verifier-266e9762-c7ef-48d6-a620-38dac16056fa",
      "last_verified_commit": "218ff50893c45cbc5a5c005329d935363bf5dfa8",
      "attempts": 1,
      "blocked_reason": null
    },
    {
      "id": "P0-W1-F03",
      "phase": 0,
      "week": 1,
      "crate": "ucil-cli",
      "description": "ucil init command creates .ucil/ directory, detects project languages, and writes ucil.toml with sensible defaults.",
      "acceptance_tests": [
        {
          "kind": "script",
          "script": "scripts/verify/P0-W1-F03.sh",
          "exit": 0
        }
      ],
      "dependencies": [
        "P0-W1-F02"
      ],
      "passes": true,
      "last_verified_ts": "2026-04-15T03:56:01Z",
      "last_verified_by": "verifier-11d36c68-4fa4-4ad3-9e52-3b1c1a7ed202",
      "last_verified_commit": "c9de11e2d4fcf9b56c634fffecf34bbabadb2814",
      "attempts": 1,
      "blocked_reason": null
    },
    {
      "id": "P0-W1-F04",
      "phase": 0,
      "week": 1,
      "crate": "ucil-cli",
      "description": "ucil init --llm-provider prompts for LLM provider selection (ollama/claude/openai/passthrough/none) and writes [llm] section to ucil.toml.",
      "acceptance_tests": [
        {
          "kind": "cargo_test",
          "selector": "-p ucil-cli commands::init::test_llm_provider_selection"
        }
      ],
      "dependencies": [
        "P0-W1-F03"
      ],
      "passes": true,
      "last_verified_ts": "2026-04-15T05:21:32Z",
      "last_verified_by": "verifier-e632b721-e2e3-4547-ad3e-ca2216470451",
      "last_verified_commit": "441092165c5d0006c44aedd0866919215cd8fb3f",
      "attempts": 0,
      "blocked_reason": null
    },
    {
      "id": "P0-W1-F05",
      "phase": 0,
      "week": 1,
      "crate": "ucil-cli",
      "description": "ucil init runs P0 plugin health verification: checks that every P0-priority external tool binary is reachable and responds to a health probe.",
      "acceptance_tests": [
        {
          "kind": "cargo_test",
          "selector": "-p ucil-cli commands::init::test_plugin_health_verification"
        }
      ],
      "dependencies": [
        "P0-W1-F03"
      ],
      "passes": true,
      "last_verified_ts": "2026-04-15T05:21:34Z",
      "last_verified_by": "verifier-e632b721-e2e3-4547-ad3e-ca2216470451",
      "last_verified_commit": "441092165c5d0006c44aedd0866919215cd8fb3f",
      "attempts": 0,
      "blocked_reason": null
    },
    {
      "id": "P0-W1-F06",
      "phase": 0,
      "week": 1,
      "crate": "ucil-cli",
      "description": "ucil init writes .ucil/init_report.json with language detections, plugin health status, LLM provider, and schema version.",
      "acceptance_tests": [
        {
          "kind": "cargo_test",
          "selector": "-p ucil-cli commands::init::test_init_report_json"
        }
      ],
      "dependencies": [
        "P0-W1-F05"
      ],
      "passes": true,
      "last_verified_ts": "2026-04-15T05:21:37Z",
      "last_verified_by": "verifier-e632b721-e2e3-4547-ad3e-ca2216470451",
      "last_verified_commit": "441092165c5d0006c44aedd0866919215cd8fb3f",
      "attempts": 0,
      "blocked_reason": null
    },
    {
      "id": "P0-W1-F07",
      "phase": 0,
      "week": 1,
      "crate": "ucil-core",
      "description": "Schema version tracking in ucil-core: migration version stamped in .ucil/state.db, checked on daemon startup, triggers migration runner if behind.",
      "acceptance_tests": [
        {
          "kind": "cargo_test",
          "selector": "-p ucil-core schema_migration::"
        }
      ],
      "dependencies": [
        "P0-W1-F01"
      ],
      "passes": true,
      "last_verified_ts": "2026-04-14T23:27:37Z",
      "last_verified_by": "verifier-266e9762-c7ef-48d6-a620-38dac16056fa",
      "last_verified_commit": "218ff50893c45cbc5a5c005329d935363bf5dfa8",
      "attempts": 0,
      "blocked_reason": null
    },
    {
      "id": "P0-W1-F08",
      "phase": 0,
      "week": 1,
      "crate": "scripts",
      "description": "CI pipeline configured: Rust cargo test + clippy, TypeScript biome check + vitest, Python ruff + mypy + pytest, all passing on a clean checkout.",
      "acceptance_tests": [
        {
          "kind": "script",
          "script": "scripts/verify/P0-W1-F08.sh",
          "exit": 0
        }
      ],
      "dependencies": [
        "P0-W1-F01"
      ],
      "passes": true,
      "last_verified_ts": "2026-04-15T05:21:39Z",
      "last_verified_by": "verifier-e632b721-e2e3-4547-ad3e-ca2216470451",
      "last_verified_commit": "441092165c5d0006c44aedd0866919215cd8fb3f",
      "attempts": 0,
      "blocked_reason": null
    },
    {
      "id": "P0-W1-F09",
      "phase": 0,
      "week": 1,
      "crate": "ucil-core",
      "description": "OpenTelemetry skeleton wired in ucil-core/src/otel.rs: init_tracer() configures stdout exporter, span creation works, no panic on startup.",
      "acceptance_tests": [
        {
          "kind": "cargo_test",
          "selector": "-p ucil-core otel::"
        }
      ],
      "dependencies": [
        "P0-W1-F01"
      ],
      "passes": true,
      "last_verified_ts": "2026-04-14T23:27:42Z",
      "last_verified_by": "verifier-266e9762-c7ef-48d6-a620-38dac16056fa",
      "last_verified_commit": "218ff50893c45cbc5a5c005329d935363bf5dfa8",
      "attempts": 0,
      "blocked_reason": null
    },
    {
      "id": "P0-W1-F10",
      "phase": 0,
      "week": 1,
      "crate": "ucil-core",
      "description": "Full repository directory skeleton matches §17: crates/, adapters/, plugins/, ml/, tests/fixtures/, scripts/, docs/ all present and committed.",
      "acceptance_tests": [
        {
          "kind": "script",
          "script": "scripts/verify/P0-W1-F10.sh",
          "exit": 0
        }
      ],
      "dependencies": [
        "P0-W1-F01"
      ],
      "passes": true,
      "last_verified_ts": "2026-04-14T22:38:14Z",
      "last_verified_by": "verifier-6c4f652d-b7fa-40fd-a006-15511bf9129c",
      "last_verified_commit": "7f5650c7e96631c425199a82fe2f5c38bd312f34",
      "attempts": 0,
      "blocked_reason": null
    },
    {
      "id": "P0-W1-F11",
      "phase": 0,
      "week": 1,
      "crate": "tests/fixtures",
      "description": "rust-project test fixture (~5K LOC Rust) committed to tests/fixtures/rust-project/ with Cargo.toml, src/, and tests/ directories.",
      "acceptance_tests": [
        {
          "kind": "cargo_test",
          "selector": "-p ucil-core -- --ignored fixture::rust_project_loads"
        }
      ],
      "dependencies": [
        "P0-W1-F01"
      ],
      "passes": true,
      "last_verified_ts": "2026-04-15T03:56:01Z",
      "last_verified_by": "verifier-11d36c68-4fa4-4ad3-9e52-3b1c1a7ed202",
      "last_verified_commit": "c9de11e2d4fcf9b56c634fffecf34bbabadb2814",
      "attempts": 2,
      "blocked_reason": null
    },
    {
      "id": "P0-W1-F12",
      "phase": 0,
      "week": 1,
      "crate": "tests/fixtures",
      "description": "python-project test fixture (~5K LOC Python) committed to tests/fixtures/python-project/ with pyproject.toml, src/, and tests/ directories.",
      "acceptance_tests": [
        {
          "kind": "pytest",
          "selector": "tests/fixtures/python_project/test_fixture_valid.py"
        }
      ],
      "dependencies": [
        "P0-W1-F01"
      ],
      "passes": true,
      "last_verified_ts": "2026-04-15T03:56:01Z",
      "last_verified_by": "verifier-11d36c68-4fa4-4ad3-9e52-3b1c1a7ed202",
      "last_verified_commit": "c9de11e2d4fcf9b56c634fffecf34bbabadb2814",
      "attempts": 3,
      "blocked_reason": null
    },
    {
      "id": "P0-W1-F13",
      "phase": 0,
      "week": 1,
      "crate": "tests/fixtures",
      "description": "typescript-project test fixture (~5K LOC TypeScript) committed to tests/fixtures/typescript-project/ with tsconfig.json, src/, and tests/ directories.",
      "acceptance_tests": [
        {
          "kind": "vitest",
          "selector": "adapters/tests/fixtures/typescript-project.test.ts"
        }
      ],
      "dependencies": [
        "P0-W1-F01"
      ],
      "passes": true,
      "last_verified_ts": "2026-04-15T03:56:01Z",
      "last_verified_by": "verifier-11d36c68-4fa4-4ad3-9e52-3b1c1a7ed202",
      "last_verified_commit": "c9de11e2d4fcf9b56c634fffecf34bbabadb2814",
      "attempts": 2,
      "blocked_reason": null
    },
    {
      "id": "P0-W1-F14",
      "phase": 0,
      "week": 1,
      "crate": "tests/fixtures",